{
  "$schema": "https://json-schema.org/draft/2020-12/schema",
  "$id": "https://schemas.manage.account.gov.uk/app-config/v1.0.0.json",
  "title": "App Config Schema",
  "description": "A schema to validate app config",
  "type": "object",
  "additionalProperties": false,
  "properties": {
    "client_registry": {
      "description": "Authorised AMC clients (Relying Parties) properties",
      "type": "array",
      "items": {
        "$ref": "#/$defs/clientEntry"
      },
      "minItems": 1,
      "uniqueItems": true
    },
    "jti_nonce_ttl_in_seconds": {
      "description": "Time-to-live in seconds for JTI nonce",
      "type": "integer",
      "minimum": 1
    },
    "auth_code_ttl": {
      "description": "Time-to-live in seconds for auth code",
      "type": "integer",
      "minimum": 1
    },
    "jwks_cache_max_age": {
      "description": "Max Age (ms) to cache JWKS",
      "type": "integer",
      "minimum": 1000
    },
    "jwks_http_timeout": {
      "description": "JWKS fetch HTTP Timeout (ms)",
      "type": "integer",
      "minimum": 1000
    },
    "journey_outcome_ttl": {
      "description": "Time-to-live in seconds for journey outcome",
      "type": "integer",
      "minimum": 1
    },
    "access_token_max_age": {
      "description": "Maximum age of access token",
      "type": "integer",
      "minimum": 1
    },
    "max_number_of_passkeys": {
      "description": "The maximum number of passkeys a user can have",
      "type": "integer"
    },
    "split_tests": {
      "description": "Split test configurations",
      "type": "object",
      "additionalProperties": false,
      "properties": {
        "testingJourneySplitTest": {
          "type": "object",
          "additionalProperties": false,
          "properties": {
            "bucket1": {
              "type": "object",
              "properties": { "percentage": { "type": "number" } },
              "required": ["percentage"],
              "additionalProperties": false
            },
            "bucket2": {
              "type": "object",
              "properties": { "percentage": { "type": "number" } },
              "required": ["percentage"],
              "additionalProperties": false
            },
            "bucket3": {
              "type": "object",
              "properties": { "percentage": { "type": "number" } },
              "required": ["percentage"],
              "additionalProperties": false
            }
          },
          "required": ["bucket1", "bucket2", "bucket3"]
        }
      },
      "required": ["testingJourneySplitTest"]
    }
  },
  "required": [
    "client_registry",
    "jti_nonce_ttl_in_seconds",
    "auth_code_ttl",
    "jwks_cache_max_age",
    "jwks_http_timeout",
    "access_token_max_age",
    "journey_outcome_ttl",
    "max_number_of_passkeys",
    "split_tests"
  ],
  "$defs": {
    "analytics": {
      "type": "object",
      "properties": {
        "contentId": { "type": "string" },
        "isPageDataSensitive": { "type": "boolean" },
        "taxonomyLevel1": { "type": "string" },
        "taxonomyLevel2": { "type": "string" },
        "taxonomyLevel3": { "type": "string" },
        "taxonomyLevel4": { "type": "string" },
        "taxonomyLevel5": { "type": "string" },
        "dynamic": { "type": "boolean" },
        "isSelectContentTrackingEnabled": { "type": "boolean" }
      },
      "additionalProperties": false
    },
    "clientEntry": {
      "type": "object",
      "additionalProperties": false,
      "properties": {
        "client_id": {
          "description": "Unique client_id issued to an AMC client",
          "type": "string",
          "pattern": "^[A-Za-z0-9]+$"
        },
        "scope": {
          "description": "String containing a space-separated list of scope values that the client can use",
          "type": "string",
          "minLength": 1,
          "maxLength": 255,
          "pattern": "^[a-z]+(?:-?[a-z]+)*(?:\\s[a-z]+(?:-?[a-z]+)*)*$"
        },
        "redirect_uris": {
          "type": "array",
          "description": "Array of redirection URI strings for use in redirect-based flows",
          "items": {
            "type": "string",
            "description": "A Redirect URI, also known as a Reply URL, specifies the URL where users are sent after the user has completed their AMC journey",
            "format": "uri",
            "pattern": "^(https|http)://(www\\.)?((localhost(:[0-9]+)?)|[-a-zA-Z0-9@:%._+~#=]{1,256}\\.[a-zA-Z0-9()]{1,6}\\b)([-a-zA-Z0-9()@:%_+.~#?&/=]*)$",
            "minLength": 1,
            "maxLength": 255
          },
          "uniqueItems": true
        },
        "client_name": {
          "description": "Human-readable string name of the client that could be presented to the end-user",
          "type": "string",
          "minLength": 1,
          "maxLength": 255
        },
        "jwks_uri": {
          "description": "URL string referencing the client's JSON Web Key (JWK) Set",
          "type": "string",
          "format": "uri",
          "pattern": "^(https|http)://(www\\.)?((localhost(:[0-9]+)?)|[-a-zA-Z0-9@:%._+~#=]{1,256}\\.[a-zA-Z0-9()]{1,6}\\b)([-a-zA-Z0-9()@:%_+.~#?&/=]*)$",
          "minLength": 1,
          "maxLength": 255
        },
        "jwks_uri_from_container": {
          "description": "URL string referencing the client's JSON Web Key (JWK) Set if the caller is in a container (only needed for local development)",
          "type": "string",
          "format": "uri",
          "pattern": "^(https|http)://(www\\.)?((localhost(:[0-9]+)?)|[-a-zA-Z0-9@:%._+~#=]{1,256}\\.[a-zA-Z0-9()]{1,6}\\b)([-a-zA-Z0-9()@:%_+.~#?&/=]*)$",
          "minLength": 1,
          "maxLength": 255
        },
        "consider_user_logged_in": {
          "description": "Boolean flag to determine if the user should be considered logged in",
          "type": "boolean"
        },
        "homepage_url": {
          "description": "Optional URL for the homepage",
          "type": "string",
          "format": "uri",
          "pattern": "^(https|http)://(www\\.)?((localhost(:[0-9]+)?)|[-a-zA-Z0-9@:%._+~#=]{1,256}\\.[a-zA-Z0-9()]{1,6}\\b)([-a-zA-Z0-9()@:%_+.~#?&/=]*)$",
          "minLength": 1,
          "maxLength": 255
        },
        "analytics": {
          "type": "object",
          "properties": {
            "passkeyCreate": { "$ref": "#/$defs/analytics" },
            "passkeyCreateError": { "$ref": "#/$defs/analytics" }
          },
          "additionalProperties": false
        },
        "journey_types_by_scope": {
          "type": "object",
          "additionalProperties": { "enum": ["SIGN_IN", "ACCOUNT_MANAGEMENT"] }
        }
      },
      "required": [
        "client_id",
        "scope",
        "redirect_uris",
        "client_name",
        "jwks_uri",
        "consider_user_logged_in"
      ]
    }
  }
}
