{
  "client_registry": [
    {
      "client_id": "auth",
      "scope": "testing-journey account-delete passkey-create",
      "redirect_uris": [
        "https://stubs.manage.build.account.gov.uk/auth/callback"
      ],
      "client_name": "Auth",
      "jwks_uri": "https://stubs.manage.build.account.gov.uk/auth/.well-known/jwks.json",
      "consider_user_logged_in": false,
      "journey_types_by_scope": {
        "passkey-create": "SIGN_IN",
        "account-delete": "SIGN_IN"
      }
    },
    {
      "client_id": "home",
      "scope": "testing-journey passkey-create",
      "redirect_uris": [
        "https://stubs.manage.build.account.gov.uk/home/callback"
      ],
      "client_name": "Home",
      "jwks_uri": "https://stubs.manage.build.account.gov.uk/home/.well-known/jwks.json",
      "consider_user_logged_in": true,
      "homepage_url": "https://home.build.account.gov.uk/your-services",
      "journey_types_by_scope": {
        "passkey-create": "ACCOUNT_MANAGEMENT"
      }
    }
  ],
  "jti_nonce_ttl_in_seconds": 7200,
  "auth_code_ttl": 300,
  "jwks_cache_max_age": 900000,
  "jwks_http_timeout": 2500,
  "access_token_max_age": 300,
  "journey_outcome_ttl": 7200,
  "max_number_of_passkeys": 5,
  "split_tests": {
    "testingJourneySplitTest": {
      "bucket1": {
        "percentage": 50
      },
      "bucket2": {
        "percentage": 30
      },
      "bucket3": {
        "percentage": 20
      }
    }
  }
}
